{
  "documentType": "d2p:conformance-case",
  "schemaVersion": "1.0.0",
  "caseId": "referential.stale-revision-command",
  "level": "referential",
  "title": "A command whose expected revision already has a child from another command is stale",
  "documents": [
    {
      "path": "conformance/referential/stale-revision-command/command.json",
      "role": "subject"
    },
    {
      "path": "conformance/referential/stale-revision-command/pattern-r1.json",
      "role": "context"
    },
    {
      "path": "conformance/referential/stale-revision-command/pattern-r2.json",
      "role": "context"
    },
    {
      "path": "conformance/referential/stale-revision-command/revision-pattern-r1.json",
      "role": "context"
    },
    {
      "path": "conformance/referential/stale-revision-command/revision-pattern-r2.json",
      "role": "context"
    }
  ],
  "expect": {
    "outcome": "reject",
    "diagnostics": [
      {
        "code": "D2P-REF-006",
        "documentPath": "conformance/referential/stale-revision-command/command.json",
        "instancePath": "/expectedRevisionId"
      }
    ]
  }
}
