{
  "documentType": "d2p:conformance-case",
  "schemaVersion": "1.0.0",
  "caseId": "golden-tshirt-drape.drape-scene-personal-undeclared",
  "level": "semantic",
  "title": "Golden T-Shirt drape: drape scene of an individual body without personalDerived",
  "documents": [
    {
      "path": "conformance/semantic/golden-tshirt-drape/drape-scene-personal-undeclared/scene-snapshot.json",
      "role": "subject"
    },
    {
      "path": "conformance/semantic/golden-tshirt-drape/drape-scene-personal/body-measurement-profile-artifact.json",
      "role": "context"
    },
    {
      "path": "conformance/semantic/golden-tshirt-drape/drape-scene-personal/body-measurement-profile-revision.json",
      "role": "context"
    },
    {
      "path": "conformance/semantic/golden-tshirt-drape/drape-scene-personal/body-measurement-profile.json",
      "role": "context"
    },
    {
      "path": "conformance/semantic/golden-tshirt-drape/drape-scene-personal/body-model-snapshot.json",
      "role": "context"
    },
    {
      "path": "conformance/semantic/golden-tshirt-drape/drape-scene-personal/draped-mesh-back.json",
      "role": "context"
    },
    {
      "path": "conformance/semantic/golden-tshirt-drape/drape-scene-personal/draped-mesh-front.json",
      "role": "context"
    },
    {
      "path": "conformance/semantic/golden-tshirt-drape/drape-scene-personal/draped-mesh-sleeve-left.json",
      "role": "context"
    },
    {
      "path": "conformance/semantic/golden-tshirt-drape/drape-scene-personal/draped-mesh-sleeve-right.json",
      "role": "context"
    },
    {
      "path": "conformance/semantic/golden-tshirt-drape/drape-scene-personal/fit-map.json",
      "role": "context"
    },
    {
      "path": "conformance/semantic/golden-tshirt-drape/drape-scene-personal/garment-artifact.json",
      "role": "context"
    },
    {
      "path": "conformance/semantic/golden-tshirt-drape/drape-scene-personal/garment-revision.json",
      "role": "context"
    },
    {
      "path": "conformance/semantic/golden-tshirt-drape/drape-scene-personal/garment.json",
      "role": "context"
    },
    {
      "path": "conformance/semantic/golden-tshirt-drape/drape-scene-personal/rest-mesh-back.json",
      "role": "context"
    },
    {
      "path": "conformance/semantic/golden-tshirt-drape/drape-scene-personal/rest-mesh-front.json",
      "role": "context"
    },
    {
      "path": "conformance/semantic/golden-tshirt-drape/drape-scene-personal/rest-mesh-sleeve-left.json",
      "role": "context"
    },
    {
      "path": "conformance/semantic/golden-tshirt-drape/drape-scene-personal/rest-mesh-sleeve-right.json",
      "role": "context"
    },
    {
      "path": "conformance/semantic/golden-tshirt-drape/drape-scene-personal/scene-input.json",
      "role": "context"
    },
    {
      "path": "conformance/semantic/golden-tshirt-drape/drape-scene-personal/sim-report.json",
      "role": "context"
    },
    {
      "path": "conformance/semantic/golden-tshirt-drape/drape-scene-personal/validation-report.json",
      "role": "context"
    },
    {
      "path": "fixtures/golden-tshirt/v1/expected/evaluations/r1-size-a-regular-woven.json",
      "role": "context"
    },
    {
      "path": "fixtures/golden-tshirt/v1/expected/evaluations/r1-size-b-regular-woven.json",
      "role": "context"
    },
    {
      "path": "fixtures/golden-tshirt/v1/expected/snapshots/r1-size-a-regular-woven.json",
      "role": "context"
    },
    {
      "path": "fixtures/golden-tshirt/v1/expected/snapshots/r1-size-b-regular-woven.json",
      "role": "context"
    },
    {
      "path": "fixtures/golden-tshirt/v1/inputs/fit-profile-regular-r1.json",
      "role": "context"
    },
    {
      "path": "fixtures/golden-tshirt/v1/inputs/garment-measurement-spec-r1.json",
      "role": "context"
    },
    {
      "path": "fixtures/golden-tshirt/v1/inputs/grading-rule-set-r1.json",
      "role": "context"
    },
    {
      "path": "fixtures/golden-tshirt/v1/inputs/pattern-r1.json",
      "role": "context"
    },
    {
      "path": "fixtures/golden-tshirt/v1/inputs/size-system-r1.json",
      "role": "context"
    },
    {
      "path": "tolerance-profiles/golden-tshirt-2d-1.0.0.json",
      "role": "context"
    },
    {
      "path": "tolerance-profiles/golden-tshirt-drape-1.0.0.json",
      "role": "context"
    },
    {
      "path": "vocabularies/avatar-profiles/standard-a-pose-1.0.0.json",
      "role": "context"
    },
    {
      "path": "vocabularies/material-physics-profiles/cotton-jersey-1.0.0.json",
      "role": "context"
    },
    {
      "path": "vocabularies/material-physics-profiles/cotton-woven-1.0.0.json",
      "role": "context"
    },
    {
      "path": "vocabularies/measurement-definitions/measurement-definitions-1.0.0.json",
      "role": "context"
    },
    {
      "path": "vocabularies/measurement-definitions/measurement-definitions-1.1.0.json",
      "role": "context"
    },
    {
      "path": "vocabularies/mesh-profiles/drape-coarse-1.0.0.json",
      "role": "context"
    },
    {
      "path": "vocabularies/solver-profiles/fit-approximation-1.0.0.json",
      "role": "context"
    },
    {
      "path": "vocabularies/validation/profiles/sample-cut-1.0.0.json",
      "role": "context"
    },
    {
      "path": "vocabularies/validation/rules/constraints-consistent-1.0.0.json",
      "role": "context"
    },
    {
      "path": "vocabularies/validation/rules/constraints-solved-1.0.0.json",
      "role": "context"
    },
    {
      "path": "vocabularies/validation/rules/contour-closed-1.0.0.json",
      "role": "context"
    },
    {
      "path": "vocabularies/validation/rules/contour-orientation-1.0.0.json",
      "role": "context"
    },
    {
      "path": "vocabularies/validation/rules/contour-simple-1.0.0.json",
      "role": "context"
    },
    {
      "path": "vocabularies/validation/rules/data-classification-consistent-1.0.0.json",
      "role": "context"
    },
    {
      "path": "vocabularies/validation/rules/ease-material-compatible-1.0.0.json",
      "role": "context"
    },
    {
      "path": "vocabularies/validation/rules/evaluation-succeeded-1.0.0.json",
      "role": "context"
    },
    {
      "path": "vocabularies/validation/rules/expression-dimensions-1.0.0.json",
      "role": "context"
    },
    {
      "path": "vocabularies/validation/rules/extensions-supported-1.0.0.json",
      "role": "context"
    },
    {
      "path": "vocabularies/validation/rules/feature-graph-acyclic-1.0.0.json",
      "role": "context"
    },
    {
      "path": "vocabularies/validation/rules/grading-consistent-1.0.0.json",
      "role": "context"
    },
    {
      "path": "vocabularies/validation/rules/measurement-equivalence-1.0.0.json",
      "role": "context"
    },
    {
      "path": "vocabularies/validation/rules/measurement-fallback-1.0.0.json",
      "role": "context"
    },
    {
      "path": "vocabularies/validation/rules/measurements-complete-1.0.0.json",
      "role": "context"
    },
    {
      "path": "vocabularies/validation/rules/references-resolve-1.0.0.json",
      "role": "context"
    },
    {
      "path": "vocabularies/validation/rules/schema-valid-1.0.0.json",
      "role": "context"
    },
    {
      "path": "vocabularies/validation/rules/seam-interface-continuous-1.0.0.json",
      "role": "context"
    },
    {
      "path": "vocabularies/validation/rules/seam-interface-single-connection-1.0.0.json",
      "role": "context"
    },
    {
      "path": "vocabularies/validation/rules/seam-length-match-1.0.0.json",
      "role": "context"
    },
    {
      "path": "vocabularies/validation/rules/sewing-group-integrity-1.0.0.json",
      "role": "context"
    },
    {
      "path": "vocabularies/validation/rules/snapshot-consistent-1.0.0.json",
      "role": "context"
    }
  ],
  "expect": {
    "outcome": "reject",
    "diagnostics": [
      {
        "code": "D2P-SEM-050",
        "documentPath": "conformance/semantic/golden-tshirt-drape/drape-scene-personal-undeclared/scene-snapshot.json"
      }
    ]
  },
  "testIds": [
    "SIM-009",
    "AVA-004"
  ],
  "description": "A scene that drapes a garment on a body model of personal measurements is personal-derived and states personalDerived: true."
}
