{
  "documentType": "d2p:conformance-case",
  "schemaVersion": "1.0.0",
  "caseId": "golden-tshirt-3d.mesh-approximation-exceeded",
  "level": "semantic",
  "title": "Golden T-Shirt 3D: panel mesh deviates more than its mesh profile permits",
  "documents": [
    {
      "path": "conformance/semantic/golden-tshirt-3d/mesh-approximation-exceeded/mesh-front.json",
      "role": "subject"
    },
    {
      "path": "conformance/semantic/golden-tshirt-3d/scene-r1-size-a/mesh-profile.json",
      "role": "context"
    },
    {
      "path": "fixtures/golden-tshirt-3d/v1/inputs/garment-size-a-r1.json",
      "role": "context"
    },
    {
      "path": "fixtures/golden-tshirt-3d/v1/inputs/scene-inputs/r1-size-a.json",
      "role": "context"
    },
    {
      "path": "fixtures/golden-tshirt/v1/expected/evaluations/r1-size-a-regular-woven.json",
      "role": "context"
    },
    {
      "path": "fixtures/golden-tshirt/v1/expected/snapshots/r1-size-a-regular-woven.json",
      "role": "context"
    },
    {
      "path": "fixtures/golden-tshirt/v1/inputs/fit-profile-regular-r1.json",
      "role": "context"
    },
    {
      "path": "fixtures/golden-tshirt/v1/inputs/garment-measurement-spec-r1.json",
      "role": "context"
    },
    {
      "path": "fixtures/golden-tshirt/v1/inputs/grading-rule-set-r1.json",
      "role": "context"
    },
    {
      "path": "fixtures/golden-tshirt/v1/inputs/pattern-r1.json",
      "role": "context"
    },
    {
      "path": "fixtures/golden-tshirt/v1/inputs/size-system-r1.json",
      "role": "context"
    },
    {
      "path": "tolerance-profiles/golden-tshirt-2d-1.0.0.json",
      "role": "context"
    },
    {
      "path": "vocabularies/measurement-definitions/measurement-definitions-1.0.0.json",
      "role": "context"
    },
    {
      "path": "vocabularies/validation/profiles/sample-cut-1.0.0.json",
      "role": "context"
    },
    {
      "path": "vocabularies/validation/rules/constraints-consistent-1.0.0.json",
      "role": "context"
    },
    {
      "path": "vocabularies/validation/rules/constraints-solved-1.0.0.json",
      "role": "context"
    },
    {
      "path": "vocabularies/validation/rules/contour-closed-1.0.0.json",
      "role": "context"
    },
    {
      "path": "vocabularies/validation/rules/contour-orientation-1.0.0.json",
      "role": "context"
    },
    {
      "path": "vocabularies/validation/rules/contour-simple-1.0.0.json",
      "role": "context"
    },
    {
      "path": "vocabularies/validation/rules/data-classification-consistent-1.0.0.json",
      "role": "context"
    },
    {
      "path": "vocabularies/validation/rules/ease-material-compatible-1.0.0.json",
      "role": "context"
    },
    {
      "path": "vocabularies/validation/rules/evaluation-succeeded-1.0.0.json",
      "role": "context"
    },
    {
      "path": "vocabularies/validation/rules/expression-dimensions-1.0.0.json",
      "role": "context"
    },
    {
      "path": "vocabularies/validation/rules/extensions-supported-1.0.0.json",
      "role": "context"
    },
    {
      "path": "vocabularies/validation/rules/feature-graph-acyclic-1.0.0.json",
      "role": "context"
    },
    {
      "path": "vocabularies/validation/rules/grading-consistent-1.0.0.json",
      "role": "context"
    },
    {
      "path": "vocabularies/validation/rules/measurement-equivalence-1.0.0.json",
      "role": "context"
    },
    {
      "path": "vocabularies/validation/rules/measurement-fallback-1.0.0.json",
      "role": "context"
    },
    {
      "path": "vocabularies/validation/rules/measurements-complete-1.0.0.json",
      "role": "context"
    },
    {
      "path": "vocabularies/validation/rules/references-resolve-1.0.0.json",
      "role": "context"
    },
    {
      "path": "vocabularies/validation/rules/schema-valid-1.0.0.json",
      "role": "context"
    },
    {
      "path": "vocabularies/validation/rules/seam-interface-continuous-1.0.0.json",
      "role": "context"
    },
    {
      "path": "vocabularies/validation/rules/seam-interface-single-connection-1.0.0.json",
      "role": "context"
    },
    {
      "path": "vocabularies/validation/rules/seam-length-match-1.0.0.json",
      "role": "context"
    },
    {
      "path": "vocabularies/validation/rules/sewing-group-integrity-1.0.0.json",
      "role": "context"
    },
    {
      "path": "vocabularies/validation/rules/snapshot-consistent-1.0.0.json",
      "role": "context"
    }
  ],
  "expect": {
    "outcome": "reject",
    "diagnostics": [
      {
        "code": "D2P-SEM-125",
        "documentPath": "conformance/semantic/golden-tshirt-3d/mesh-approximation-exceeded/mesh-front.json"
      }
    ]
  },
  "testIds": [
    "T3D-003"
  ]
}
